#----------------------------------------
# JasperGold Version Info
# tool      : JasperGold 2019.06
# platform  : Linux 3.10.0-1160.118.1.el7.x86_64
# version   : 2019.06 FCS 64 bits
# build date: 2019.06.29 18:06:18 PDT
#----------------------------------------
# started Tue Feb 24 21:28:16 PKT 2026
# hostname  : localhost.localdomain
# pid       : 7120
# arguments : '-label' 'session_0' '-console' 'localhost.localdomain:41962' '-style' 'windows' '-data' 'AQAAADx/////AAAAAAAAA3oBAAAAEABMAE0AUgBFAE0ATwBWAEU=' '-proj' '/home/ali_sajjad/Desktop/fpv_db/data_manager/jgproject/sessionLogs/session_0' '-init' '-hidden' '/home/ali_sajjad/Desktop/fpv_db/data_manager/jgproject/.tmp/.initCmds.tcl' '/home/ali_sajjad/Desktop/fpv_db/data_manager/scripts/jg.tcl'

Any disclosure about the Cadence Design Systems software or its use
model to any third party violates the written Non-Disclosure Agreement
between Cadence Design Systems, Inc. and the customer.

THIS SOFTWARE CONTAINS CONFIDENTIAL INFORMATION AND TRADE SECRETS OF
CADENCE DESIGN SYSTEMS, INC. USE, DISCLOSURE, OR REPRODUCTION IS
PROHIBITED WITHOUT THE PRIOR EXPRESS WRITTEN PERMISSION OF CADENCE
DESIGN SYSTEMS, INC.

Copyright (C) 2000-2019 Cadence Design Systems, Inc. All Rights
Reserved.  Unpublished -- rights reserved under the copyright laws of
the United States.

This product includes software developed by others and redistributed
according to license agreement. See doc/third_party_readme.txt for
further details.

RESTRICTED RIGHTS LEGEND

Use, duplication, or disclosure by the Government is subject to
restrictions as set forth in subparagraph (c) (1) (ii) of the Rights in
Technical Data and Computer Software clause at DFARS 252.227-7013 or
subparagraphs (c) (1) and (2) of Commercial Computer Software -- Restricted
Rights at 48 CFR 52.227-19, as applicable.


                          Cadence Design Systems, Inc. 
                          2655 Seely Avenue
                          San Jose, CA 95134
                          Phone: 408.943.1234

For technical assistance visit http://support.cadence.com.

JasperGold Apps Analysis Session - /home/ali_sajjad/Desktop/fpv_db/data_manager/jgproject/sessionLogs/session_0

/home/ali_sajjad/Desktop/fpv_db/data_manager/jgproject/jg.log
INFO: successfully checked out licenses "jasper_interactive" and "jasper_fpv".
INFO: reading configuration file "/home/ali_sajjad/.config/jasper/jaspergold.conf".
% 
% clear -all
INFO (IPF121): Cleared environment completely for new design analysis.
% 
% global env
% 
% 
% set design_top        $env(DUT_TOP)
data_manager
% set lab_path          $env(FPV_PATH)
/home/ali_sajjad/Desktop/fpv_db/data_manager
% 
% analyze -sv09 $lab_path/rtl/data_manager.sv
[-- (VERI-1482)] Analyzing Verilog file '/home/icdesign/cadence/installs/Jasper_2019/lib/verilog/packages/std/std.sv' into library 'std'
[-- (VERI-1482)] Analyzing Verilog file '/home/ali_sajjad/Desktop/fpv_db/data_manager/rtl/data_manager.sv'
% 
% analyze -sv09 $lab_path/bind/data_manager_bind.sv $lab_path/sva/data_manager_sva.sv
[-- (VERI-1482)] Analyzing Verilog file '/home/ali_sajjad/Desktop/fpv_db/data_manager/bind/data_manager_bind.sv'
[-- (VERI-1482)] Analyzing Verilog file '/home/ali_sajjad/Desktop/fpv_db/data_manager/sva/data_manager_sva.sv'
% 
% elaborate  -top data_manager -disable_auto_bbox -create_related_covers {precondition witness}
INFO (ISW003): Top module name is "data_manager".
[INFO (VERI-1018)] /home/ali_sajjad/Desktop/fpv_db/data_manager/rtl/data_manager.sv(1): compiling module 'data_manager'
[INFO (VERI-1018)] /home/ali_sajjad/Desktop/fpv_db/data_manager/sva/data_manager_sva.sv(2): compiling module 'data_manager_sva'
[WARN (VERI-1209)] /home/ali_sajjad/Desktop/fpv_db/data_manager/sva/data_manager_sva.sv(108): expression size 32 truncated to fit in target size 1
data_manager
[<embedded>] % 
[<embedded>] % clock clk
[<embedded>] % reset reset
INFO (IPM031): Clearing proof results of all properties.
INFO (IRS006): Current reset condition is "reset".
[<embedded>] % 
[<embedded>] % get_design_info
Statistics [for instance "data_manager"]
---------------------------
# Flops:         105 (3322) (133 property flop bits)
# Latches:       0 (0)
# Gates:         1999 (53019)
# Nets:          2127
# Ports:         10
# RTL Lines:     284
# RTL Instances: 2
# Embedded Assumptions: 2
# Embedded Assertions:  6
# Embedded Covers:      6
3322
[<embedded>] % 
[<embedded>] % set_engine_mode auto
[<embedded>] % 
[<embedded>] % set_proofgrid_manager on
[<embedded>] % 
[<embedded>] % ##prove -bg -all
[<embedded>] % prove -bg -all
Hpcustom1: Custom engine code is hT3NZbhPPfqY2AbBQnsjfOxn6c+6e6yL+/e8fYueaMCoQAEA
background 0
INFO (IPF036): Starting proof on task: "<embedded>", 23 properties to prove with 0 already proven/unreachable
INFO (IRS029): Starting reset analysis: phase 1 of 4.
INFO (IRS030): Running reset analysis: phase 2 of 4.
INFO (IRS031): Running reset analysis: phase 3 of 4.
INFO (IRS020): Starting the reset analysis simulation with a limit of 100 iterations (phase 4 of 4).
INFO (IRS024): Reset iterations 0 to 4 analyzed.
INFO (IRS018): Reset analysis simulation executed for 3 iterations. Assigned values for 117 of 3189 design flops, 0 of 0 design latches, 158 of 158 internal elements.
INFO (IRS039): Reset analysis complete.
INFO (IPF031): Settings used for proof thread 0:
    orchestration                 = on (auto)
    time_limit                    = 86400s
    per_property_time_limit       = 1s * 10 ^ scan
    engine_mode                   = auto
    proofgrid_per_engine_max_jobs = 1
    max engine jobs               = auto
    proofgrid_mode                = local
    proofgrid_restarts            = 10
0: Using multistage preprocessing
AMcustom2: Custom engine code is hT3N/LhP/2Dz3DrVSe2lNjiSpGmyu5Klv2ELvwL2WCQ+iY7rtAZ05ZC7TYTjerFjm57AUr54KxI2LGPAdQPc+eiMri1dI47yA50CRDdixbORmxz6cC+fZzChw2WXiQWUpM8rQS1DvRGCnsdRtkwXwn5/wC8U1oGSk2zvtl/p5mB+RV+nlTid0KCMqOgMR7nmW6XEAQA
0: Starting reduce
Ncustom3: Custom engine code is hT3NR7hPByLp3DrFSTPhwoIgCxPsqvZp21H/ym7EyTra3ms6eTBVZwJJnDhKmpN3woHootcWDlvmP07qcJRE1mUlIYMcSXUf1ExUD+hh5xN33vG9+qWOknUTM64CUjZpIk7qvPS+5IOws79QOzn5IqFPWD8RgByBUKPsu4ZUa9AO97P6cus4/HdmN+iijpsbAG5PrODXEeit9bdDREds7k7Rd2Vug5lgs78jIAEA
Ncustom4: Custom engine code is hT3NR7hPByFp3TrFSTLhUmMH4KWtJglTyV/c51BHEeZWamnJv767nE6PCak26bd3gf3XGN3rIRheufhDieCJQVISo+gNYUKhiUedBKGtsP/a18svAnlMJZudHxDFwK5ufsyoxsIyiAeSY2oi3tEuoDHr5gw42DFKAG3PqO3CEsl8Azzdt3pl5nGA1Ifv2H02eYsFzWb/nfp8PMb3F0krE/EgBcm8TD9Div8BAA
Tricustom5: Custom engine code is hT3Nu7hP3fiYQADBZnYcglNHp9bfd7EOeniIqP/ji8sGLQu8yhsFO+wxJ+O+R0bU8g/IewXFomyos+viQnWc2xYNYmMqpo3i40O7DaZR7qfp4YqNx26KRvQ/qx0BAA
0: Finished reduce in 0.003s
0.0.PRE: Performing Proof Simplification...
0.0.N: clocks: 1, declared: 1, disabling: 0, posedge: 1, negedge: 0, noedge: 0, bothedge: 0
0.0.N: Proof Simplification Iteration 1	[0.00 s]
0.0.N: Proof Simplification Iteration 2	[0.00 s]
0.0.N: Proof Simplification Iteration 3	[0.00 s]
0.0.N: Proof Simplification Iteration 4	[0.00 s]
0.0.N: Proof Simplification Iteration 5	[0.01 s]
0.0.N: Proof Simplification Iteration 6	[0.01 s]
0.0.N: Proof Simplification Iteration 7	[0.01 s]
0.0.N: Proof Simplification Iteration 8	[0.01 s]
0.0.N: Proof Simplification Iteration 9	[0.01 s]
0.0.N: Proof Simplification Iteration 10	[0.01 s]
0.0.N: Proof Simplification Iteration 11	[0.01 s]
0.0.N: Proof Simplification Iteration 12	[0.02 s]
0.0.N: Proof Simplification Iteration 13	[0.02 s]
0.0.N: Proof Simplification Iteration 14	[0.02 s]
0.0.N: Proof Simplification Iteration 15	[0.02 s]
0.0.N: Proof Simplification Iteration 16	[0.02 s]
0.0.N: Proof Simplification Iteration 17	[0.02 s]
0.0.N: Proof Simplification Iteration 18	[0.03 s]
0.0.N: Proof Simplification Iteration 19	[0.03 s]
0.0.N: Proof Simplification Iteration 20	[0.03 s]
0.0.N: Proof Simplification Iteration 21	[0.03 s]
0.0.N: Proof Simplification Iteration 22	[0.03 s]
0.0.N: Proof Simplification Iteration 23	[0.03 s]
0.0.N: Proof Simplification Iteration 24	[0.03 s]
0.0.N: Proof Simplification Iteration 25	[0.04 s]
0.0.N: Proof Simplification Iteration 26	[0.04 s]
0.0.N: Proof Simplification Iteration 27	[0.04 s]
0.0.N: Proof Simplification Iteration 28	[0.04 s]
0.0.N: Proof Simplification Iteration 29	[0.04 s]
0.0.N: Proof Simplification Iteration 30	[0.04 s]
0.0.N: Proof Simplification Iteration 31	[0.04 s]
0.0.N: Proof Simplification Iteration 32	[0.04 s]
0.0.N: Proof Simplification Iteration 33	[0.05 s]
0.0.N: Proof Simplification Iteration 34	[0.05 s]
0.0.PRE: Proof Simplification completed in 0.14 s
0.0.N: Identified and disabled 3 duplicated targets.
0: About to start ProofGrid in its own thread with a limit of 10000 pending notifications and a limit of 10 traces.
0: =============================== ProofGrid start ===============================
0: ProofGrid usable level: 20
0: ProofGrid is starting event handling
0.0.N: Proofgrid shell started at 7276@localhost.localdomain(local) jg_7120_localhost.localdomain_1
0.0.N: clocks: 1, declared: 1, disabling: 0, posedge: 1, negedge: 0, noedge: 0, bothedge: 0
0.0.N: Next scan (0) will use per property time limit: 1s * 10 ^ 0 = 1s
0.0.N: Starting proof for property "data_manager.u_data_manager_sva.asm_retire_ptr_range:witness1"	[0.00 s].
0.0.N: Trace Attempt  1	[0.00 s]
0.0.N: A max_length bound was found. The shortest trace is no longer than 16777217 cycles. [0.00 s]
INFO (IPF008): 0.0.N: A max_length bound of 16777217 was found for the property "data_manager.u_data_manager_sva.asm_retire_ptr_range:witness1" in 0.00 s.
0.0.N: Trace Attempt  2	[0.00 s]
0.0.N: Trace Attempt  2	[0.00 s]
0.0.N: A trace with 2 cycles was found. [0.00 s]
INFO (IPF047): 0.0.N: The cover property "data_manager.u_data_manager_sva.asm_retire_ptr_range:witness1" was covered in 2 cycles in 0.02 s.
INFO (IPF047): 0.0.N: The cover property "data_manager.u_data_manager_sva.asm_retire_ptr_range:precondition1" was covered in 2 cycles in 0.02 s by the incidental trace "data_manager.u_data_manager_sva.asm_retire_ptr_range:witness1".
INFO (IPF047): 0.0.N: The cover property "data_manager.u_data_manager_sva.ast_id_increment:witness1" was covered in 2 cycles in 0.02 s by the incidental trace "data_manager.u_data_manager_sva.asm_retire_ptr_range:witness1".
INFO (IPF047): 0.0.N: The cover property "data_manager.u_data_manager_sva.ast_id_increment:precondition1" was covered in 1 cycles in 0.02 s by the incidental trace "data_manager.u_data_manager_sva.asm_retire_ptr_range:witness1".
INFO (IPF047): 0.0.N: The cover property "data_manager.u_data_manager_sva.ast_no_replay_outstanding:witness1" was covered in 1 cycles in 0.02 s by the incidental trace "data_manager.u_data_manager_sva.asm_retire_ptr_range:witness1".
INFO (IPF047): 0.0.N: The cover property "data_manager.u_data_manager_sva.ast_no_replay_outstanding:precondition1" was covered in 1 cycles in 0.02 s by the incidental trace "data_manager.u_data_manager_sva.asm_retire_ptr_range:witness1".
0.0.N: Stopped processing property "data_manager.u_data_manager_sva.asm_retire_ptr_range:witness1"	[0.02 s].
0.0.N: Starting proof for property "data_manager.u_data_manager_sva.asm_abort_id_valid_range:witness1"	[0.00 s].
0.0.N: Starting proof for property "data_manager.u_data_manager_sva.asm_abort_id_valid_range:precondition1"	[0.00 s].
0.0.N: Starting proof for property "data_manager.u_data_manager_sva.ast_abort_on_outstanding:precondition1"	[0.00 s].
0.0.N: Starting proof for property "data_manager.u_data_manager_sva.ast_abort_update_data_id:precondition1"	[0.00 s].
0.0.N: Trace Attempt  1	[0.00 s]
0.0.N: A trace with 1 cycles was found. [0.00 s]
INFO (IPF047): 0.0.N: The cover property "data_manager.u_data_manager_sva.asm_abort_id_valid_range:witness1" was covered in 1 cycles in 0.00 s.
INFO (IPF047): 0.0.N: The cover property "data_manager.u_data_manager_sva.ast_abort_on_outstanding:witness1" was covered in 1 cycles in 0.00 s by the incidental trace "data_manager.u_data_manager_sva.asm_abort_id_valid_range:witness1".
INFO (IPF047): 0.0.N: The cover property "data_manager.u_data_manager_sva.asm_abort_id_valid_range:precondition1" was covered in 1 cycles in 0.00 s.
INFO (IPF047): 0.0.N: The cover property "data_manager.u_data_manager_sva.ast_abort_on_outstanding:precondition1" was covered in 1 cycles in 0.00 s.
INFO (IPF047): 0.0.N: The cover property "data_manager.u_data_manager_sva.ast_abort_update_data_id:precondition1" was covered in 1 cycles in 0.00 s.
0.0.N: Stopped processing property "data_manager.u_data_manager_sva.asm_abort_id_valid_range:witness1"	[0.00 s].
0.0.N: Stopped processing property "data_manager.u_data_manager_sva.asm_abort_id_valid_range:precondition1"	[0.00 s].
0.0.N: Stopped processing property "data_manager.u_data_manager_sva.ast_abort_on_outstanding:precondition1"	[0.00 s].
0.0.N: Stopped processing property "data_manager.u_data_manager_sva.ast_abort_update_data_id:precondition1"	[0.00 s].
0.0.N: Starting proof for property "data_manager.u_data_manager_sva.ast_stable_when_not_ready"	[0.00 s].
0.0.N: Trace Attempt  1	[0.00 s]
0.0.N: Trace Attempt  2	[0.00 s]
0.0.N: Trace Attempt  2	[0.00 s]
0.0.N: Trace Attempt  3	[0.00 s]
0.0.Hp: Proofgrid shell started at 7277@localhost.localdomain(local) jg_7120_localhost.localdomain_1
0.0.N: Trace Attempt  3	[0.01 s]
0.0.Hp: clocks: 1, declared: 1, disabling: 0, posedge: 1, negedge: 0, noedge: 0, bothedge: 0
0.0.N: A trace with 3 cycles was found. [0.01 s]
INFO (IPF055): 0.0.N: A counterexample (cex) with 3 cycles was found for the property "data_manager.u_data_manager_sva.ast_stable_when_not_ready" in 0.00 s.
INFO (IPF047): 0.0.N: The cover property "data_manager.u_data_manager_sva.ast_stable_when_not_ready:precondition1" was covered in 2 cycles in 0.00 s by the incidental trace "data_manager.u_data_manager_sva.ast_stable_when_not_ready".
0.0.N: Stopped processing property "data_manager.u_data_manager_sva.ast_stable_when_not_ready"	[0.01 s].
0.0.N: Starting proof for property "data_manager.u_data_manager_sva.ast_stable_when_not_ready:witness1"	[0.00 s].
0.0.N: Trace Attempt  1	[0.00 s]
0.0.N: Trace Attempt  2	[0.00 s]
0.0.N: Trace Attempt  2	[0.00 s]
0.0.N: A trace with 2 cycles was found. [0.00 s]
INFO (IPF047): 0.0.N: The cover property "data_manager.u_data_manager_sva.ast_stable_when_not_ready:witness1" was covered in 2 cycles in 0.00 s.
0.0.N: Stopped processing property "data_manager.u_data_manager_sva.ast_stable_when_not_ready:witness1"	[0.00 s].
0.0.N: Starting proof for property "data_manager.u_data_manager_sva.ast_id_increment"	[0.00 s].
0.0.N: Trace Attempt  1	[0.00 s]
0.0.N: Trace Attempt  2	[0.00 s]
0.0.N: Trace Attempt  2	[0.00 s]
0.0.N: Trace Attempt  3	[0.00 s]
0.0.N: Trace Attempt  3	[0.00 s]
0.0.N: Trace Attempt  4	[0.00 s]
0.0.N: Trace Attempt  5	[0.01 s]
0.0.N: Trace Attempt  5	[0.01 s]
0.0.N: A trace with 5 cycles was found. [0.01 s]
INFO (IPF055): 0.0.N: A counterexample (cex) with 5 cycles was found for the property "data_manager.u_data_manager_sva.ast_id_increment" in 0.00 s.
INFO (IPF055): 0.0.N: A counterexample (cex) with 3 cycles was found for the property "data_manager.u_data_manager_sva.ast_abort_on_outstanding" in 0.00 s by the incidental trace "data_manager.u_data_manager_sva.ast_id_increment".
INFO (IPF055): 0.0.N: A counterexample (cex) with 4 cycles was found for the property "data_manager.u_data_manager_sva.ast_abort_update_data_id" in 0.00 s by the incidental trace "data_manager.u_data_manager_sva.ast_id_increment".
0.0.N: Stopped processing property "data_manager.u_data_manager_sva.ast_id_increment"	[0.00 s].
0.0.N: Starting proof for property "data_manager.u_data_manager_sva.ast_full_depth_outstanding"	[0.00 s].
0.0.N: Trace Attempt  1	[0.00 s]
0.0.N: A max_length bound was found. The shortest trace is no longer than 33554433 cycles. [0.00 s]
INFO (IPF008): 0.0.N: A max_length bound of 33554433 was found for the property "data_manager.u_data_manager_sva.ast_full_depth_outstanding" in 0.00 s.
0.0.N: Trace Attempt  2	[0.00 s]
0.0.N: Trace Attempt  3	[0.00 s]
0.0.N: Trace Attempt  3	[0.00 s]
0.0.N: Trace Attempt  4	[0.00 s]
0.0.N: Trace Attempt  4	[0.00 s]
0.0.N: A trace with 4 cycles was found. [0.01 s]
INFO (IPF055): 0.0.N: A counterexample (cex) with 4 cycles was found for the property "data_manager.u_data_manager_sva.ast_full_depth_outstanding" in 0.00 s.
INFO (IPF047): 0.0.N: The cover property "data_manager.u_data_manager_sva.ast_full_depth_outstanding:precondition1" was covered in 3 cycles in 0.00 s by the incidental trace "data_manager.u_data_manager_sva.ast_full_depth_outstanding".
INFO (IPF047): 0.0.N: The cover property "data_manager.u_data_manager_sva.ast_abort_update_data_id:witness1" was covered in 4 cycles in 0.00 s by the incidental trace "data_manager.u_data_manager_sva.ast_full_depth_outstanding".
0.0.N: Stopped processing property "data_manager.u_data_manager_sva.ast_full_depth_outstanding"	[0.00 s].
0.0.N: Starting proof for property "data_manager.u_data_manager_sva.ast_full_depth_outstanding:witness1"	[0.00 s].
0.0.N: Trace Attempt  1	[0.00 s]
0.0.N: A max_length bound was found. The shortest trace is no longer than 33554433 cycles. [0.00 s]
INFO (IPF008): 0.0.N: A max_length bound of 33554433 was found for the property "data_manager.u_data_manager_sva.ast_full_depth_outstanding:witness1" in 0.00 s.
0.0.N: Trace Attempt  2	[0.00 s]
0.0.N: Trace Attempt  2	[0.00 s]
0.0.N: Trace Attempt  3	[0.00 s]
0.0.N: Trace Attempt  3	[0.00 s]
0.0.Hp: Trace Attempt  1	[0.02 s]
0.0.Hp: Trace Attempt  2	[0.02 s]
0.0.N: Trace Attempt  4	[0.00 s]
0.0.N: Trace Attempt  4	[0.01 s]
0.0.N: A trace with 4 cycles was found. [0.01 s]
INFO (IPF047): 0.0.N: The cover property "data_manager.u_data_manager_sva.ast_full_depth_outstanding:witness1" was covered in 4 cycles in 0.00 s.
0.0.N: Stopped processing property "data_manager.u_data_manager_sva.ast_full_depth_outstanding:witness1"	[0.00 s].
0.0.N: Starting proof for property "data_manager.u_data_manager_sva.ast_no_replay_outstanding"	[0.00 s].
0.0.N: Trace Attempt  1	[0.00 s]
0.0.N: Trace Attempt  2	[0.00 s]
0.0.N: Trace Attempt  2	[0.00 s]
0.0.N: Trace Attempt  3	[0.01 s]
0.0.N: Trace Attempt  3	[0.01 s]
0.0.Hp: Trace Attempt  3	[0.04 s]
0.0.Ht: Proofgrid shell started at 7291@localhost.localdomain(local) jg_7120_localhost.localdomain_1
0.0.Ht: clocks: 1, declared: 1, disabling: 0, posedge: 1, negedge: 0, noedge: 0, bothedge: 0
0.0.B: Proofgrid shell started at 7292@localhost.localdomain(local) jg_7120_localhost.localdomain_1
0.0.B: clocks: 1, declared: 1, disabling: 0, posedge: 1, negedge: 0, noedge: 0, bothedge: 0
0.0.B: Next scan (0) will use per property time limit: 1s * 10 ^ 0 = 1s
0.0.B: Starting proof for property "data_manager.u_data_manager_sva.ast_no_replay_outstanding"	[0.00 s].
0.0.Ht: Trace Attempt  1	[0.00 s]
0.0.Ht: Trace Attempt  2	[0.00 s]
0.0.Ht: Trace Attempt  3	[0.00 s]
0.0.B: Trace Attempt  1	[0.00 s]
0.0.N: Trace Attempt  4	[0.02 s]
0.0.Ht: Trace Attempt  4	[0.01 s]
0.0.B: Trace Attempt  2	[0.00 s]
0.0.Ht: A trace with 4 cycles was found. [0.01 s]
INFO (IPF055): 0.0.Ht: A counterexample (cex) with 4 cycles was found for the property "data_manager.u_data_manager_sva.ast_no_replay_outstanding" in 0.01 s.
0.0.Ht: Trace Attempt  5	[0.01 s]
0.0.N: Stopped processing property "data_manager.u_data_manager_sva.ast_no_replay_outstanding"	[0.01 s].
0.0.N: Last scan. Per property time limit: 0s
0.0.N: Starting proof for property "data_manager.u_data_manager_sva.cover_data_ids_wrap"	[0.00 s].
0.0.B: Stopped processing property "data_manager.u_data_manager_sva.ast_no_replay_outstanding"	[0.01 s].
0.0.B: Last scan. Per property time limit: 0s
0.0.B: Starting proof for property "data_manager.u_data_manager_sva.cover_data_ids_wrap"	[0.00 s].
0.0.N: Trace Attempt  1	[0.00 s]
0.0.N: Trace Attempt  2	[0.00 s]
0.0.B: Trace Attempt  1	[0.00 s]
0.0.N: Trace Attempt  3	[0.00 s]
0.0.B: Trace Attempt  2	[0.00 s]
0.0.N: Trace Attempt  3	[0.00 s]
0.0.N: Trace Attempt  4	[0.00 s]
0.0.N: Trace Attempt  5	[0.00 s]
0.0.B: Trace Attempt  3	[0.00 s]
0.0.N: Trace Attempt  5	[0.00 s]
0.0.B: Trace Attempt  4	[0.00 s]
0.0.B: Trace Attempt  5	[0.01 s]
0.0.N: Requesting engine job to stop
0.0.B: Requesting engine job to stop
0.0.Hp: Requesting engine job to terminate
0.0.Ht: Requesting engine job to terminate
INFO (IPF144): 0: Initiating shutdown of proof [0.13]
0.0.Ht: Trace Attempt 49	[0.03 s]
0.0.Ht: A trace with 49 cycles was found. [0.08 s]
INFO (IPF047): 0.0.Ht: The cover property "data_manager.u_data_manager_sva.cover_data_ids_wrap" was covered in 49 cycles in 0.08 s.
0.0.Ht: All properties determined. [0.08 s]
0.0.N: Stopped processing property "data_manager.u_data_manager_sva.cover_data_ids_wrap"	[0.07 s].
0.0.N: Trace Attempt 27	[0.07 s]
0.0.N: Interrupted. [0.13 s]
0.0.Hp: Interrupted (multi)
0.0.Hp: Interrupted. [0.12 s]
0.0.Ht: Exited with Success (@ 0.13 s)
0: ProofGrid usable level: 0
0.0.N: Exited with Success (@ 0.13 s)
0.0.Hp: Exited with Success (@ 0.13 s)
0.0.B: Stopped processing property "data_manager.u_data_manager_sva.cover_data_ids_wrap"	[0.07 s].
0.0.B: Trace Attempt 33	[0.07 s]
0.0.B: Interrupted. [0.08 s]
0.0.B: Exited with Success (@ 0.13 s)
0: --------------------------------------------------------------
ProofGrid Summary
--------------------------------------------------------------
     engines started                               :     4
     engine jobs started                           :     4

    Average time in state (seconds)
    ------------------------------------------------------
    Engine  Pending     Running        Dead    Utilization
    ------------------------------------------------------
      N        0.06        0.13        0.00       67.57 %
     Hp        0.07        0.12        0.00       63.02 %
     Ht        0.05        0.08        0.00       62.08 %
      B        0.05        0.08        0.00       60.29 %
    all        0.06        0.10        0.00       63.64 %

    Data read    : 35.82 kiB
    Data written : 5.98 kiB

0: All pending notifications were processed.
INFO (IPF059): Completed proof on task: "<embedded>" for proof thread 0

==============================================================
SUMMARY
==============================================================
           Properties Considered              : 23
                 assertions                   : 6
                  - proven                    : 0 (0%)
                  - bounded_proven (user)     : 0 (0%)
                  - bounded_proven (auto)     : 0 (0%)
                  - marked_proven             : 0 (0%)
                  - cex                       : 6 (100%)
                  - ar_cex                    : 0 (0%)
                  - undetermined              : 0 (0%)
                  - unknown                   : 0 (0%)
                  - error                     : 0 (0%)
                 covers                       : 17
                  - unreachable               : 0 (0%)
                  - bounded_unreachable (user): 0 (0%)
                  - covered                   : 17 (100%)
                  - ar_covered                : 0 (0%)
                  - undetermined              : 0 (0%)
                  - unknown                   : 0 (0%)
                  - error                     : 0 (0%)
[<embedded>] % visualize -violation -property <embedded>::data_manager.u_data_manager_sva.ast_stable_when_not_ready -new_window
INFO (IVS015): Setting Visualize task to "<embedded>".
INFO (IVS008): Expanding analysis region to enable visualization of "<embedded>::data_manager.u_data_manager_sva.ast_stable_when_not_ready".
cex
[<embedded>] % visualize -violation -property <embedded>::data_manager.u_data_manager_sva.ast_stable_when_not_ready -new_window
INFO (IVS015): Setting Visualize task to "<embedded>".
INFO (IVS008): Expanding analysis region to enable visualization of "<embedded>::data_manager.u_data_manager_sva.ast_stable_when_not_ready".
cex
[<embedded>] % check_reset
ERROR (ESW054): A required switch is missing.


[<embedded>] % get_reset_info
List of Registers: 9
-----------------
current_data
  Value at reset: 32'b0
outstanding_cnt
  Value at reset: 6'b0
retire_ptr_q
  Value at reset: 6'b0
send_ptr
  Value at reset: 6'b0
u_data_manager_sva.abort_id_in_range
  Value at reset: 1'b0
u_data_manager_sva.max_ptr
  Value at reset: 6'b0
u_data_manager_sva.min_ptr
  Value at reset: 6'b0
u_data_manager_sva.out_q
  Value at reset: 48'b0
u_data_manager_sva.retire_ptr_q
  Value at reset: 6'b0
{current_data 32'b0} {outstanding_cnt 6'b0} {retire_ptr_q 6'b0} {send_ptr 6'b0} {u_data_manager_sva.abort_id_in_range 1'b0} {u_data_manager_sva.max_ptr 6'b0} {u_data_manager_sva.min_ptr 6'b0} {u_data_manager_sva.out_q 48'b0} {u_data_manager_sva.retire_ptr_q 6'b0}
[<embedded>] % include {/home/ali_sajjad/Desktop/fpv_db/data_manager/scripts/jg.tcl}
%% 
%% clear -all
INFO (IPF121): Cleared environment completely for new design analysis.
%% 
%% global env
%% 
%% 
%% set design_top        $env(DUT_TOP)
data_manager
%% set lab_path          $env(FPV_PATH)
/home/ali_sajjad/Desktop/fpv_db/data_manager
%% 
%% analyze -sv09 $lab_path/rtl/data_manager.sv
[-- (VERI-1482)] Analyzing Verilog file '/home/icdesign/cadence/installs/Jasper_2019/lib/verilog/packages/std/std.sv' into library 'std'
[-- (VERI-1482)] Analyzing Verilog file '/home/ali_sajjad/Desktop/fpv_db/data_manager/rtl/data_manager.sv'
%% 
%% analyze -sv09 $lab_path/bind/data_manager_bind.sv $lab_path/sva/data_manager_sva.sv
[-- (VERI-1482)] Analyzing Verilog file '/home/ali_sajjad/Desktop/fpv_db/data_manager/bind/data_manager_bind.sv'
[-- (VERI-1482)] Analyzing Verilog file '/home/ali_sajjad/Desktop/fpv_db/data_manager/sva/data_manager_sva.sv'
%% 
%% elaborate  -top data_manager -disable_auto_bbox -create_related_covers {precondition witness}
INFO (ISW003): Top module name is "data_manager".
[INFO (VERI-1018)] /home/ali_sajjad/Desktop/fpv_db/data_manager/rtl/data_manager.sv(1): compiling module 'data_manager'
[INFO (VERI-1018)] /home/ali_sajjad/Desktop/fpv_db/data_manager/sva/data_manager_sva.sv(2): compiling module 'data_manager_sva'
[WARN (VERI-1209)] /home/ali_sajjad/Desktop/fpv_db/data_manager/sva/data_manager_sva.sv(108): expression size 32 truncated to fit in target size 1
INFO (INL003): Clearing all state information (assumes, stopats, and so forth).
data_manager
%% 
%% clock clk
%% reset reset
INFO (IPM031): Clearing proof results of all properties.
INFO (IRS006): Current reset condition is "reset".
%% 
%% get_design_info
Statistics [for instance "data_manager"]
---------------------------
# Flops:         105 (3368) (179 property flop bits)
# Latches:       0 (0)
# Gates:         2122 (53534)
# Nets:          2250
# Ports:         10
# RTL Lines:     284
# RTL Instances: 2
# Embedded Assumptions: 10
# Embedded Assertions:  6
# Embedded Covers:      6
3368
%% 
%% set_engine_mode auto
%% 
%% set_proofgrid_manager on
%% 
%% ##prove -bg -all
[<embedded>] % prove -bg -all
background 0
INFO (IPF036): Starting proof on task: "<embedded>", 35 properties to prove with 0 already proven/unreachable
INFO (IRS029): Starting reset analysis: phase 1 of 4.
INFO (IRS030): Running reset analysis: phase 2 of 4.
INFO (IRS031): Running reset analysis: phase 3 of 4.
INFO (IRS020): Starting the reset analysis simulation with a limit of 100 iterations (phase 4 of 4).
INFO (IRS024): Reset iterations 0 to 4 analyzed.
INFO (IRS018): Reset analysis simulation executed for 3 iterations. Assigned values for 117 of 3189 design flops, 0 of 0 design latches, 178 of 224 internal elements.
INFO (IRS039): Reset analysis complete.
INFO (IPF031): Settings used for proof thread 0:
    orchestration                 = on (auto)
    time_limit                    = 86400s
    per_property_time_limit       = 1s * 10 ^ scan
    engine_mode                   = auto
    proofgrid_per_engine_max_jobs = 1
    max engine jobs               = auto
    proofgrid_mode                = local
    proofgrid_restarts            = 10
0: Using multistage preprocessing
0: Starting reduce
0: Finished reduce in 0.02s
0.0.PRE: A proof was found: No trace exists. [0.00 s]
INFO (IPF051): 0.0.PRE: The cover property "data_manager.u_data_manager_sva.asm_retire_ptr_jump:witness1" was proven unreachable in 0.00 s.
0.0.PRE: A proof was found: No trace exists. [0.00 s]
INFO (IPF051): 0.0.PRE: The cover property "data_manager.u_data_manager_sva.asm_retire_ptr_jump:precondition1" was proven unreachable in 0.00 s.
0.0.PRE: A proof was found: No trace exists. [0.00 s]
INFO (IPF051): 0.0.PRE: The cover property "data_manager.u_data_manager_sva.asm_retire_ptr_range:witness1" was proven unreachable in 0.00 s.
0.0.PRE: A proof was found: No trace exists. [0.00 s]
INFO (IPF051): 0.0.PRE: The cover property "data_manager.u_data_manager_sva.asm_retire_ptr_range:precondition1" was proven unreachable in 0.00 s.
0: Found proofs for 4 properties in preprocessing
0.0.PRE: Performing Proof Simplification...
0.0.N: clocks: 1, declared: 1, disabling: 0, posedge: 1, negedge: 0, noedge: 0, bothedge: 0
0.0.N: Proof Simplification Iteration 1	[0.00 s]
0.0.N: Proof Simplification Iteration 2	[0.01 s]
0.0.N: Proof Simplification Iteration 3	[0.02 s]
0.0.N: Proof Simplification Iteration 4	[0.03 s]
0.0.N: Proof Simplification Iteration 5	[0.05 s]
0.0.N: Proof Simplification Iteration 6	[0.06 s]
0.0.N: Proof Simplification Iteration 7	[0.07 s]
0.0.N: Proof Simplification Iteration 8	[0.08 s]
0.0.N: Proof Simplification Iteration 9	[0.09 s]
0.0.N: Proof Simplification Iteration 10	[0.10 s]
0.0.N: Proof Simplification Iteration 11	[0.12 s]
0.0.N: Proof Simplification Iteration 12	[0.12 s]
0.0.N: Proof Simplification Iteration 13	[0.14 s]
0.0.N: Proof Simplification Iteration 14	[0.14 s]
0.0.N: Proof Simplification Iteration 15	[0.16 s]
0.0.N: Proof Simplification Iteration 16	[0.17 s]
0.0.N: Proof Simplification Iteration 17	[0.18 s]
0.0.N: Proof Simplification Iteration 18	[0.19 s]
0.0.N: Proof Simplification Iteration 19	[0.20 s]
0.0.N: Proof Simplification Iteration 20	[0.21 s]
0.0.N: Proof Simplification Iteration 21	[0.22 s]
0.0.N: Proof Simplification Iteration 22	[0.23 s]
0.0.N: Proof Simplification Iteration 23	[0.24 s]
0.0.N: Proof Simplification Iteration 24	[0.25 s]
0.0.N: Proof Simplification Iteration 25	[0.26 s]
0.0.N: Proof Simplification Iteration 26	[0.27 s]
0.0.N: Proof Simplification Iteration 27	[0.28 s]
0.0.N: Proof Simplification Iteration 28	[0.29 s]
0.0.N: Proof Simplification Iteration 29	[0.30 s]
0.0.N: Proof Simplification Iteration 30	[0.31 s]
0.0.N: Proof Simplification Iteration 31	[0.32 s]
0.0.N: Proof Simplification Iteration 32	[0.33 s]
0.0.N: Proof Simplification Iteration 33	[0.34 s]
0.0.N: Proof Simplification Iteration 34	[0.35 s]
0.0.PRE: Proof Simplification completed in 0.42 s
0.0.N: Identified and disabled 6 duplicated targets.
0: About to start ProofGrid in its own thread with a limit of 10000 pending notifications and a limit of 10 traces.
0: =============================== ProofGrid start ===============================
0: ProofGrid usable level: 25
0: ProofGrid is starting event handling
0.0.Hp: Proofgrid shell started at 23970@localhost.localdomain(local) jg_7120_localhost.localdomain_2
0.0.Hp: clocks: 1, declared: 1, disabling: 0, posedge: 1, negedge: 0, noedge: 0, bothedge: 0
0.0.N: Proofgrid shell started at 23969@localhost.localdomain(local) jg_7120_localhost.localdomain_2
0.0.N: clocks: 1, declared: 1, disabling: 0, posedge: 1, negedge: 0, noedge: 0, bothedge: 0
0.0.N: A trace with 1 cycles was found. [0.01 s]
INFO (IPF047): 0.0.N: The cover property "data_manager.u_data_manager_sva.asm_ready_i_stable:witness1" was covered in 1 cycles in 0.00 s.
INFO (IPF047): 0.0.N: The cover property "data_manager.u_data_manager_sva.ast_stable_when_not_ready:precondition1" was covered in 1 cycles in 0.00 s.
INFO (IPF047): 0.0.N: The cover property "data_manager.u_data_manager_sva.asm_abort_vld_stable:witness1" was covered in 1 cycles in 0.00 s.
INFO (IPF047): 0.0.N: The cover property "data_manager.u_data_manager_sva.asm_abort_id_stable:witness1" was covered in 1 cycles in 0.00 s.
INFO (IPF047): 0.0.N: The cover property "data_manager.u_data_manager_sva.asm_retire_ptr_stable:witness1" was covered in 1 cycles in 0.00 s.
0.0.N: Next scan (0) will use per property time limit: 1s * 10 ^ 0 = 1s
0.0.N: Starting proof for property "data_manager.u_data_manager_sva.asm_ready_i_stable:witness1"	[0.00 s].
0.0.N: Starting proof for property "data_manager.u_data_manager_sva.asm_abort_vld_stable:witness1"	[0.00 s].
0.0.N: Starting proof for property "data_manager.u_data_manager_sva.asm_abort_id_stable:witness1"	[0.00 s].
0.0.N: Starting proof for property "data_manager.u_data_manager_sva.asm_retire_ptr_stable:witness1"	[0.00 s].
0.0.N: Stopped processing property "data_manager.u_data_manager_sva.asm_ready_i_stable:witness1"	[0.00 s].
0.0.N: Stopped processing property "data_manager.u_data_manager_sva.asm_abort_vld_stable:witness1"	[0.00 s].
0.0.N: Stopped processing property "data_manager.u_data_manager_sva.asm_abort_id_stable:witness1"	[0.00 s].
0.0.N: Stopped processing property "data_manager.u_data_manager_sva.asm_retire_ptr_stable:witness1"	[0.00 s].
0.0.N: Starting proof for property "data_manager.u_data_manager_sva.asm_abort_data_stable:witness1"	[0.00 s].
0.0.N: Trace Attempt  1	[0.01 s]
0.0.N: A trace with 1 cycles was found. [0.01 s]
INFO (IPF047): 0.0.N: The cover property "data_manager.u_data_manager_sva.asm_abort_data_stable:witness1" was covered in 1 cycles in 0.01 s.
INFO (IPF047): 0.0.N: The cover property "data_manager.u_data_manager_sva.asm_abort_data_stable:precondition1" was covered in 1 cycles in 0.01 s by the incidental trace "data_manager.u_data_manager_sva.asm_abort_data_stable:witness1".
INFO (IPF047): 0.0.N: The cover property "data_manager.u_data_manager_sva.asm_abort_id_when_empty:witness1" was covered in 1 cycles in 0.01 s by the incidental trace "data_manager.u_data_manager_sva.asm_abort_data_stable:witness1".
INFO (IPF047): 0.0.N: The cover property "data_manager.u_data_manager_sva.asm_abort_id_when_empty:precondition1" was covered in 1 cycles in 0.01 s by the incidental trace "data_manager.u_data_manager_sva.asm_abort_data_stable:witness1".
INFO (IPF047): 0.0.N: The cover property "data_manager.u_data_manager_sva.asm_abort_id_valid_range:witness1" was covered in 1 cycles in 0.01 s by the incidental trace "data_manager.u_data_manager_sva.asm_abort_data_stable:witness1".
INFO (IPF047): 0.0.N: The cover property "data_manager.u_data_manager_sva.ast_abort_on_outstanding:witness1" was covered in 1 cycles in 0.01 s by the incidental trace "data_manager.u_data_manager_sva.asm_abort_data_stable:witness1".
INFO (IPF047): 0.0.N: The cover property "data_manager.u_data_manager_sva.asm_abort_id_valid_range:precondition1" was covered in 1 cycles in 0.01 s by the incidental trace "data_manager.u_data_manager_sva.asm_abort_data_stable:witness1".
INFO (IPF047): 0.0.N: The cover property "data_manager.u_data_manager_sva.ast_abort_on_outstanding:precondition1" was covered in 1 cycles in 0.01 s by the incidental trace "data_manager.u_data_manager_sva.asm_abort_data_stable:witness1".
INFO (IPF047): 0.0.N: The cover property "data_manager.u_data_manager_sva.ast_abort_update_data_id:precondition1" was covered in 1 cycles in 0.01 s by the incidental trace "data_manager.u_data_manager_sva.asm_abort_data_stable:witness1".
0.0.N: Stopped processing property "data_manager.u_data_manager_sva.asm_abort_data_stable:witness1"	[0.01 s].
0.0.N: Starting proof for property "data_manager.u_data_manager_sva.asm_abort_data_matches_sent:witness1"	[0.00 s].
0.0.N: Trace Attempt  1	[0.00 s]
0.0.Hp: Trace Attempt  1	[0.04 s]
0.0.Hp: A trace with 1 cycles was found. [0.04 s]
INFO (IPF047): 0.0.Hp: The cover property "data_manager.u_data_manager_sva.ast_id_increment:precondition1" was covered in 1 cycles in 0.04 s.
INFO (IPF047): 0.0.Hp: The cover property "data_manager.u_data_manager_sva.ast_no_replay_outstanding:witness1" was covered in 1 cycles in 0.04 s.
INFO (IPF047): 0.0.Hp: The cover property "data_manager.u_data_manager_sva.ast_no_replay_outstanding:precondition1" was covered in 1 cycles in 0.04 s.
0.0.N: Trace Attempt  2	[0.02 s]
0.0.N: Trace Attempt  3	[0.02 s]
0.0.N: Trace Attempt  4	[0.02 s]
0.0.N: Trace Attempt  5	[0.03 s]
0.0.B: Proofgrid shell started at 23984@localhost.localdomain(local) jg_7120_localhost.localdomain_2
0.0.B: clocks: 1, declared: 1, disabling: 0, posedge: 1, negedge: 0, noedge: 0, bothedge: 0
0.0.Ht: Proofgrid shell started at 23983@localhost.localdomain(local) jg_7120_localhost.localdomain_2
0.0.B: Next scan (0) will use per property time limit: 1s * 10 ^ 0 = 1s
0.0.B: Starting proof for property "data_manager.u_data_manager_sva.asm_abort_data_matches_sent:witness1"	[0.00 s].
0.0.Ht: clocks: 1, declared: 1, disabling: 0, posedge: 1, negedge: 0, noedge: 0, bothedge: 0
0.0.B: Trace Attempt  1	[0.01 s]
0.0.Ht: Trace Attempt  1	[0.02 s]
0.0.Ht: Trace Attempt  2	[0.02 s]
0.0.N: Trace Attempt  1	[0.06 s]
0.0.Ht: A trace with 2 cycles was found. [0.02 s]
INFO (IPF047): 0.0.Ht: The cover property "data_manager.u_data_manager_sva.ast_stable_when_not_ready:witness1" was covered in 2 cycles in 0.02 s.
0.0.N: Trace Attempt  2	[0.06 s]
0.0.B: Trace Attempt  2	[0.03 s]
0.0.Ht: A trace with 2 cycles was found. [0.03 s]
INFO (IPF047): 0.0.Ht: The cover property "data_manager.u_data_manager_sva.ast_id_increment:witness1" was covered in 2 cycles in 0.03 s.
0.0.Ht: A trace with 2 cycles was found. [0.03 s]
INFO (IPF047): 0.0.Ht: The cover property "data_manager.u_data_manager_sva.ast_abort_update_data_id:witness1" was covered in 2 cycles in 0.03 s.
0.0.Ht: Trace Attempt  3	[0.03 s]
0.0.Ht: Trace Attempt  4	[0.04 s]
0.0.N: Trace Attempt  3	[0.08 s]
0.0.Ht: Trace Attempt  5	[0.06 s]
0.0.N: Validation of fixpoint was successful. Time = 0.01
0.0.N: A proof was found: No trace exists. [0.11 s]
INFO (IPF051): 0.0.N: The cover property "data_manager.u_data_manager_sva.asm_abort_data_matches_sent:witness1" was proven unreachable in 0.10 s.
0.0.N: Stopped processing property "data_manager.u_data_manager_sva.asm_abort_data_matches_sent:witness1"	[0.10 s].
0.0.N: Starting proof for property "data_manager.u_data_manager_sva.asm_abort_data_matches_sent:precondition1"	[0.00 s].
0.0.N: Trace Attempt  1	[0.01 s]
0.0.B: Stopped processing property "data_manager.u_data_manager_sva.asm_abort_data_matches_sent:witness1"	[0.09 s].
0.0.B: Starting proof for property "data_manager.u_data_manager_sva.asm_abort_data_matches_sent:precondition1"	[0.00 s].
0.0.N: Trace Attempt  2	[0.01 s]
0.0.N: Trace Attempt  3	[0.01 s]
0.0.N: Trace Attempt  4	[0.02 s]
0.0.B: Trace Attempt  1	[0.01 s]
0.0.N: Trace Attempt  5	[0.02 s]
0.0.B: Trace Attempt  2	[0.02 s]
0.0.N: Trace Attempt  1	[0.05 s]
0.0.N: Trace Attempt  2	[0.06 s]
0.0.N: Validation of fixpoint was successful. Time = 0.00
0.0.N: A proof was found: No trace exists. [0.08 s]
INFO (IPF051): 0.0.N: The cover property "data_manager.u_data_manager_sva.asm_abort_data_matches_sent:precondition1" was proven unreachable in 0.08 s.
0.0.N: Stopped processing property "data_manager.u_data_manager_sva.asm_abort_data_matches_sent:precondition1"	[0.08 s].
0.0.N: Starting proof for property "data_manager.u_data_manager_sva.ast_stable_when_not_ready"	[0.00 s].
0.0.N: Trace Attempt  1	[0.00 s]
0.0.N: Trace Attempt  2	[0.01 s]
0.0.N: Trace Attempt  2	[0.01 s]
0.0.N: Trace Attempt  3	[0.02 s]
0.0.N: Trace Attempt  4	[0.02 s]
0.0.N: Trace Attempt  5	[0.02 s]
0.0.N: Trace Attempt  1	[0.02 s]
0.0.N: Trace Attempt  2	[0.02 s]
0.0.N: Validation of fixpoint was successful. Time = 0.00
0.0.N: A proof was found: No trace exists. [0.03 s]
INFO (IPF057): 0.0.N: The property "data_manager.u_data_manager_sva.ast_stable_when_not_ready" was proven in 0.03 s.
0.0.N: Stopped processing property "data_manager.u_data_manager_sva.ast_stable_when_not_ready"	[0.03 s].
0.0.N: Starting proof for property "data_manager.u_data_manager_sva.ast_id_increment"	[0.00 s].
0.0.N: Trace Attempt  1	[0.00 s]
0.0.N: Trace Attempt  2	[0.01 s]
0.0.B: Stopped processing property "data_manager.u_data_manager_sva.asm_abort_data_matches_sent:precondition1"	[0.11 s].
0.0.B: Starting proof for property "data_manager.u_data_manager_sva.ast_id_increment"	[0.00 s].
0.0.N: Trace Attempt  2	[0.01 s]
0.0.N: Trace Attempt  3	[0.02 s]
0.0.N: Trace Attempt  4	[0.02 s]
0.0.N: Trace Attempt  5	[0.02 s]
0.0.N: Trace Attempt  1	[0.02 s]
0.0.N: Trace Attempt  2	[0.02 s]
0.0.N: Trace Attempt  3	[0.03 s]
0.0.N: Validation of fixpoint was successful. Time = 0.00
0.0.B: Trace Attempt  1	[0.01 s]
0.0.N: A proof was found: No trace exists. [0.03 s]
INFO (IPF057): 0.0.N: The property "data_manager.u_data_manager_sva.ast_id_increment" was proven in 0.03 s.
0.0.N: Stopped processing property "data_manager.u_data_manager_sva.ast_id_increment"	[0.03 s].
0.0.N: Starting proof for property "data_manager.u_data_manager_sva.ast_full_depth_outstanding"	[0.00 s].
0.0.N: Trace Attempt  1	[0.01 s]
0.0.N: Trace Attempt  2	[0.01 s]
0.0.N: Trace Attempt  3	[0.01 s]
0.0.B: Stopped processing property "data_manager.u_data_manager_sva.ast_id_increment"	[0.02 s].
0.0.B: Starting proof for property "data_manager.u_data_manager_sva.ast_full_depth_outstanding"	[0.00 s].
0.0.B: Trace Attempt  1	[0.01 s]
0.0.N: Trace Attempt  3	[0.02 s]
0.0.B: Trace Attempt  2	[0.02 s]
0.0.N: Trace Attempt  4	[0.04 s]
0.0.N: Trace Attempt  5	[0.04 s]
0.0.Hp: Lemmas used(2): ?4
0.0.Hp: A proof was found: No trace exists. [0.32 s]
INFO (IPF057): 0.0.Hp: The property "data_manager.u_data_manager_sva.ast_abort_update_data_id" was proven in 0.32 s.
0.0.B: Trace Attempt  3	[0.04 s]
0.0.N: Trace Attempt  1	[0.07 s]
0.0.B: Trace Attempt  4	[0.06 s]
0.0.N: Trace Attempt  2	[0.07 s]
0.0.N: Trace Attempt  3	[0.10 s]
0.0.B: Trace Attempt  5	[0.09 s]
0.0.N: Trace Attempt  4	[0.11 s]
0.0.N: Validation of fixpoint was successful. Time = 0.00
0.0.N: Trace Attempt  6	[0.12 s]
0.0.N: A proof was found: No trace exists. [0.16 s]
INFO (IPF057): 0.0.N: The property "data_manager.u_data_manager_sva.ast_full_depth_outstanding" was proven in 0.16 s.
0.0.N: Stopped processing property "data_manager.u_data_manager_sva.ast_full_depth_outstanding"	[0.16 s].
0.0.N: Starting proof for property "data_manager.u_data_manager_sva.ast_full_depth_outstanding:witness1"	[0.00 s].
0.0.N: Trace Attempt  1	[0.00 s]
0.0.N: Trace Attempt  2	[0.01 s]
0.0.N: Trace Attempt  2	[0.01 s]
0.0.N: Trace Attempt  3	[0.02 s]
0.0.N: Trace Attempt  3	[0.03 s]
0.0.B: Stopped processing property "data_manager.u_data_manager_sva.ast_full_depth_outstanding"	[0.19 s].
0.0.B: Starting proof for property "data_manager.u_data_manager_sva.ast_full_depth_outstanding:witness1"	[0.00 s].
0.0.B: Trace Attempt  1	[0.01 s]
0.0.N: Trace Attempt  4	[0.05 s]
0.0.N: Trace Attempt  5	[0.05 s]
0.0.B: Trace Attempt  2	[0.02 s]
0.0.B: Trace Attempt  3	[0.04 s]
0.0.B: Trace Attempt  4	[0.06 s]
0.0.B: Trace Attempt  5	[0.09 s]
0.0.N: Trace Attempt  1	[0.16 s]
0.0.N: Trace Attempt  2	[0.16 s]
0.0.N: Trace Attempt  3	[0.18 s]
0.0.N: Trace Attempt  4	[0.18 s]
0.0.N: Trace Attempt  5	[0.20 s]
0.0.Hp: Lemmas used(4): ?6
0.0.Hp: A proof was found: No trace exists. [0.77 s]
INFO (IPF057): 0.0.Hp: The property "data_manager.u_data_manager_sva.ast_abort_on_outstanding" was proven in 0.76 s.
0: ProofGrid usable level: 4
0.0.N: Trace Attempt 37	[0.96 s]
0.0.N: Per property time limit expired (1.00 s) [1.00 s]
0.0.N: Stopped processing property "data_manager.u_data_manager_sva.ast_full_depth_outstanding:witness1"	[1.00 s].
0.0.N: Starting proof for property "data_manager.u_data_manager_sva.ast_full_depth_outstanding:precondition1"	[0.00 s].
0.0.N: Trace Attempt  1	[0.00 s]
0.0.N: Trace Attempt  2	[0.01 s]
0.0.N: Trace Attempt  2	[0.01 s]
0.0.N: Trace Attempt  3	[0.02 s]
0.0.N: Trace Attempt  4	[0.02 s]
0.0.N: Trace Attempt  5	[0.03 s]
0.0.B: Stopped processing property "data_manager.u_data_manager_sva.ast_full_depth_outstanding:witness1"	[0.99 s].
0.0.B: Starting proof for property "data_manager.u_data_manager_sva.ast_full_depth_outstanding:precondition1"	[0.00 s].
0.0.B: Trace Attempt  1	[0.01 s]
0.0.B: Trace Attempt  2	[0.02 s]
0.0.N: Trace Attempt  5	[0.05 s]
0.0.B: Trace Attempt  3	[0.04 s]
0.0.B: Trace Attempt  4	[0.07 s]
0.0.N: Trace Attempt  1	[0.11 s]
0.0.N: Trace Attempt  2	[0.11 s]
0.0.N: Trace Attempt  3	[0.12 s]
0.0.B: Trace Attempt  5	[0.10 s]
0.0.N: Trace Attempt  4	[0.14 s]
0.0.N: Trace Attempt  5	[0.14 s]
0.0.N: Trace Attempt 41	[1.00 s]
0.0.N: Per property time limit expired (1.00 s) [1.00 s]
0.0.N: Stopped processing property "data_manager.u_data_manager_sva.ast_full_depth_outstanding:precondition1"	[1.01 s].
0.0.N: Starting proof for property "data_manager.u_data_manager_sva.ast_no_replay_outstanding"	[0.00 s].
0.0.N: Trace Attempt  1	[0.01 s]
0.0.N: Trace Attempt  2	[0.01 s]
0.0.N: Trace Attempt  2	[0.01 s]
0.0.N: Trace Attempt  3	[0.03 s]
0.0.N: Trace Attempt  3	[0.04 s]
0.0.N: Trace Attempt  4	[0.06 s]
0.0.N: Trace Attempt  4	[0.08 s]
0.0.B: Stopped processing property "data_manager.u_data_manager_sva.ast_full_depth_outstanding:precondition1"	[1.06 s].
0.0.B: Starting proof for property "data_manager.u_data_manager_sva.ast_no_replay_outstanding"	[0.00 s].
0.0.B: Trace Attempt  1	[0.01 s]
0.0.B: Trace Attempt  2	[0.02 s]
0.0.N: Trace Attempt  5	[0.10 s]
0.0.B: Trace Attempt  3	[0.04 s]
0.0.N: Trace Attempt  5	[0.13 s]
0.0.B: Trace Attempt  4	[0.06 s]
0.0.B: Trace Attempt  5	[0.09 s]
0.0.Ht: Trace Attempt 49	[2.51 s]
0.0.Ht: A trace with 49 cycles was found. [2.60 s]
INFO (IPF047): 0.0.Ht: The cover property "data_manager.u_data_manager_sva.ast_full_depth_outstanding:precondition1" was covered in 49 cycles in 2.62 s.
0.0.Ht: A trace with 49 cycles was found. [2.85 s]
INFO (IPF047): 0.0.Ht: The cover property "data_manager.u_data_manager_sva.cover_data_ids_wrap" was covered in 49 cycles in 2.88 s.
0: ProofGrid usable level: 2
0.0.Ht: Trace Attempt 50	[2.90 s]
0.0.Ht: A trace with 50 cycles was found. [3.03 s]
INFO (IPF047): 0.0.Ht: The cover property "data_manager.u_data_manager_sva.ast_full_depth_outstanding:witness1" was covered in 50 cycles in 3.05 s.
0.0.N: Trace Attempt 13	[1.04 s]
0.0.N: Per property time limit expired (1.00 s) [1.04 s]
0.0.N: Stopped processing property "data_manager.u_data_manager_sva.ast_no_replay_outstanding"	[1.04 s].
0.0.N: Last scan. Per property time limit: 0s
0.0.N: Starting proof for property "data_manager.u_data_manager_sva.ast_no_replay_outstanding"	[0.00 s].
0.0.B: Stopped processing property "data_manager.u_data_manager_sva.ast_no_replay_outstanding"	[0.98 s].
0.0.B: Last scan. Per property time limit: 0s
0.0.B: Starting proof for property "data_manager.u_data_manager_sva.ast_no_replay_outstanding"	[0.00 s].
0.0.B: Trace Attempt  1	[0.01 s]
0.0.B: Trace Attempt  2	[0.02 s]
0.0.N: Trace Attempt 12	[0.05 s]
0.0.B: Trace Attempt  3	[0.04 s]
0.0.B: Trace Attempt  4	[0.06 s]
0.0.B: Trace Attempt  5	[0.09 s]
0: ProofGrid usable level: 1
0.0.Ht: Trace Attempt 76	[7.08 s]
0.0.N: Trace Attempt 27	[4.12 s]
0.0.B: Trace Attempt 63	[4.13 s]
0.0.Hp: Lemmas used(49): ?7
0.0.N: Requesting engine job to stop
0.0.B: Requesting engine job to stop
0.0.Hp: Requesting engine job to terminate
0.0.Ht: Requesting engine job to terminate
INFO (IPF144): 0: Initiating shutdown of proof [7.92]
0.0.Hp: A proof was found: No trace exists. [7.92 s]
INFO (IPF057): 0.0.Hp: The property "data_manager.u_data_manager_sva.ast_no_replay_outstanding" was proven in 7.91 s.
0.0.Hp: All properties determined. [7.92 s]
0.0.Hp: Exited with Success (@ 7.94 s)
0: ProofGrid usable level: 0
0.0.Ht: Interrupted (multi)
0.0.Ht: Trace Attempt 80	[7.85 s]
0.0.Ht: Interrupted. [7.93 s]
0.0.B: Stopped processing property "data_manager.u_data_manager_sva.ast_no_replay_outstanding"	[4.50 s].
0.0.Ht: Exited with Success (@ 8.02 s)
0.0.B: Trace Attempt 65	[4.34 s]
0.0.B: Interrupted. [7.96 s]
0.0.B: Exited with Success (@ 8.03 s)
0.0.N: Stopped processing property "data_manager.u_data_manager_sva.ast_no_replay_outstanding"	[4.55 s].
0.0.N: Trace Attempt 28	[4.54 s]
0.0.N: Interrupted. [8.03 s]
0.0.N: Exited with Success (@ 8.05 s)
0: --------------------------------------------------------------
ProofGrid Summary
--------------------------------------------------------------
     engines started                               :     4
     engine jobs started                           :     4

    Average time in state (seconds)
    ------------------------------------------------------
    Engine  Pending     Running        Dead    Utilization
    ------------------------------------------------------
      N        0.08        7.92        0.00       98.96 %
     Hp        0.07        7.92        0.00       99.08 %
     Ht        0.06        7.86        0.00       99.21 %
      B        0.06        7.86        0.00       99.26 %
    all        0.07        7.89        0.00       99.13 %

    Data read    : 418.69 kiB
    Data written : 8.97 kiB

0: All pending notifications were processed.
INFO (IPF059): Completed proof on task: "<embedded>" for proof thread 0

==============================================================
SUMMARY
==============================================================
           Properties Considered              : 35
                 assertions                   : 6
                  - proven                    : 6 (100%)
                  - bounded_proven (user)     : 0 (0%)
                  - bounded_proven (auto)     : 0 (0%)
                  - marked_proven             : 0 (0%)
                  - cex                       : 0 (0%)
                  - ar_cex                    : 0 (0%)
                  - undetermined              : 0 (0%)
                  - unknown                   : 0 (0%)
                  - error                     : 0 (0%)
                 covers                       : 29
                  - unreachable               : 6 (20.6897%)
                  - bounded_unreachable (user): 0 (0%)
                  - covered                   : 23 (79.3103%)
                  - ar_covered                : 0 (0%)
                  - undetermined              : 0 (0%)
                  - unknown                   : 0 (0%)
                  - error                     : 0 (0%)
[<embedded>] % include {/home/ali_sajjad/Desktop/fpv_db/data_manager/scripts/jg.tcl}
%% 
%% clear -all
INFO (IPF121): Cleared environment completely for new design analysis.
%% 
%% global env
%% 
%% 
%% set design_top        $env(DUT_TOP)
data_manager
%% set lab_path          $env(FPV_PATH)
/home/ali_sajjad/Desktop/fpv_db/data_manager
%% 
%% analyze -sv09 $lab_path/rtl/data_manager.sv
[-- (VERI-1482)] Analyzing Verilog file '/home/icdesign/cadence/installs/Jasper_2019/lib/verilog/packages/std/std.sv' into library 'std'
[-- (VERI-1482)] Analyzing Verilog file '/home/ali_sajjad/Desktop/fpv_db/data_manager/rtl/data_manager.sv'
%% 
%% analyze -sv09 $lab_path/bind/data_manager_bind.sv $lab_path/sva/data_manager_sva.sv
[-- (VERI-1482)] Analyzing Verilog file '/home/ali_sajjad/Desktop/fpv_db/data_manager/bind/data_manager_bind.sv'
[-- (VERI-1482)] Analyzing Verilog file '/home/ali_sajjad/Desktop/fpv_db/data_manager/sva/data_manager_sva.sv'
%% 
%% elaborate  -top data_manager -disable_auto_bbox -create_related_covers {precondition witness}
INFO (ISW003): Top module name is "data_manager".
[INFO (VERI-1018)] /home/ali_sajjad/Desktop/fpv_db/data_manager/rtl/data_manager.sv(1): compiling module 'data_manager'
[INFO (VERI-1018)] /home/ali_sajjad/Desktop/fpv_db/data_manager/sva/data_manager_sva.sv(2): compiling module 'data_manager_sva'
[WARN (VERI-1209)] /home/ali_sajjad/Desktop/fpv_db/data_manager/sva/data_manager_sva.sv(108): expression size 32 truncated to fit in target size 1
INFO (INL003): Clearing all state information (assumes, stopats, and so forth).
data_manager
%% 
%% clock clk
%% reset reset
INFO (IPM031): Clearing proof results of all properties.
INFO (IRS006): Current reset condition is "reset".
%% 
%% get_design_info
Statistics [for instance "data_manager"]
---------------------------
# Flops:         105 (3322) (133 property flop bits)
# Latches:       0 (0)
# Gates:         2056 (53408)
# Nets:          2184
# Ports:         10
# RTL Lines:     284
# RTL Instances: 2
# Embedded Assumptions: 5
# Embedded Assertions:  6
# Embedded Covers:      6
3322
%% 
%% set_engine_mode auto
%% 
%% set_proofgrid_manager on
%% 
%% ##prove -bg -all
[<embedded>] % prove -bg -all
background 0
INFO (IPF036): Starting proof on task: "<embedded>", 29 properties to prove with 0 already proven/unreachable
INFO (IRS029): Starting reset analysis: phase 1 of 4.
INFO (IRS030): Running reset analysis: phase 2 of 4.
INFO (IRS031): Running reset analysis: phase 3 of 4.
INFO (IRS020): Starting the reset analysis simulation with a limit of 100 iterations (phase 4 of 4).
INFO (IRS024): Reset iterations 0 to 4 analyzed.
INFO (IRS018): Reset analysis simulation executed for 3 iterations. Assigned values for 117 of 3189 design flops, 0 of 0 design latches, 167 of 167 internal elements.
INFO (IRS039): Reset analysis complete.
INFO (IPF031): Settings used for proof thread 0:
    orchestration                 = on (auto)
    time_limit                    = 86400s
    per_property_time_limit       = 1s * 10 ^ scan
    engine_mode                   = auto
    proofgrid_per_engine_max_jobs = 1
    max engine jobs               = auto
    proofgrid_mode                = local
    proofgrid_restarts            = 10
0: Using multistage preprocessing
0: Starting reduce
0: Finished reduce in 0.021s
0.0.PRE: Performing Proof Simplification...
0.0.N: clocks: 1, declared: 1, disabling: 0, posedge: 1, negedge: 0, noedge: 0, bothedge: 0
0.0.N: Proof Simplification Iteration 1	[0.00 s]
0.0.N: Proof Simplification Iteration 2	[0.01 s]
0.0.N: Proof Simplification Iteration 3	[0.03 s]
0.0.N: Proof Simplification Iteration 4	[0.04 s]
0.0.N: Proof Simplification Iteration 5	[0.05 s]
0.0.N: Proof Simplification Iteration 6	[0.06 s]
0.0.N: Proof Simplification Iteration 7	[0.07 s]
0.0.N: Proof Simplification Iteration 8	[0.08 s]
0.0.N: Proof Simplification Iteration 9	[0.09 s]
0.0.N: Proof Simplification Iteration 10	[0.10 s]
0.0.N: Proof Simplification Iteration 11	[0.12 s]
0.0.N: Proof Simplification Iteration 12	[0.13 s]
0.0.N: Proof Simplification Iteration 13	[0.14 s]
0.0.N: Proof Simplification Iteration 14	[0.15 s]
0.0.N: Proof Simplification Iteration 15	[0.16 s]
0.0.N: Proof Simplification Iteration 16	[0.18 s]
0.0.N: Proof Simplification Iteration 17	[0.19 s]
0.0.N: Proof Simplification Iteration 18	[0.20 s]
0.0.N: Proof Simplification Iteration 19	[0.21 s]
0.0.N: Proof Simplification Iteration 20	[0.22 s]
0.0.N: Proof Simplification Iteration 21	[0.23 s]
0.0.N: Proof Simplification Iteration 22	[0.24 s]
0.0.N: Proof Simplification Iteration 23	[0.26 s]
0.0.N: Proof Simplification Iteration 24	[0.27 s]
0.0.N: Proof Simplification Iteration 25	[0.28 s]
0.0.N: Proof Simplification Iteration 26	[0.29 s]
0.0.N: Proof Simplification Iteration 27	[0.30 s]
0.0.N: Proof Simplification Iteration 28	[0.32 s]
0.0.N: Proof Simplification Iteration 29	[0.33 s]
0.0.N: Proof Simplification Iteration 30	[0.34 s]
0.0.N: Proof Simplification Iteration 31	[0.35 s]
0.0.N: Proof Simplification Iteration 32	[0.36 s]
0.0.N: Proof Simplification Iteration 33	[0.37 s]
0.0.N: Proof Simplification Iteration 34	[0.38 s]
0.0.PRE: Proof Simplification completed in 0.41 s
0.0.N: Identified and disabled 5 duplicated targets.
0: About to start ProofGrid in its own thread with a limit of 10000 pending notifications and a limit of 10 traces.
0: =============================== ProofGrid start ===============================
0: ProofGrid usable level: 24
0: ProofGrid is starting event handling
0.0.N: Proofgrid shell started at 25419@localhost.localdomain(local) jg_7120_localhost.localdomain_3
0.0.Hp: Proofgrid shell started at 25420@localhost.localdomain(local) jg_7120_localhost.localdomain_3
0.0.N: clocks: 1, declared: 1, disabling: 0, posedge: 1, negedge: 0, noedge: 0, bothedge: 0
0.0.Hp: clocks: 1, declared: 1, disabling: 0, posedge: 1, negedge: 0, noedge: 0, bothedge: 0
0.0.N: Next scan (0) will use per property time limit: 1s * 10 ^ 0 = 1s
0.0.N: Starting proof for property "data_manager.u_data_manager_sva.asm_retire_ptr_jump:witness1"	[0.00 s].
0.0.N: Starting proof for property "data_manager.u_data_manager_sva.asm_retire_ptr_jump:precondition1"	[0.00 s].
0.0.N: Starting proof for property "data_manager.u_data_manager_sva.asm_retire_ptr_range:precondition1"	[0.00 s].
0.0.N: Trace Attempt  1	[0.01 s]
0.0.N: Trace Attempt  2	[0.01 s]
0.0.N: Trace Attempt  2	[0.01 s]
0.0.N: A trace with 2 cycles was found. [0.02 s]
INFO (IPF047): 0.0.N: The cover property "data_manager.u_data_manager_sva.asm_retire_ptr_jump:witness1" was covered in 2 cycles in 0.04 s.
INFO (IPF047): 0.0.N: The cover property "data_manager.u_data_manager_sva.asm_retire_ptr_range:witness1" was covered in 2 cycles in 0.04 s by the incidental trace "data_manager.u_data_manager_sva.asm_retire_ptr_jump:witness1".
INFO (IPF047): 0.0.N: The cover property "data_manager.u_data_manager_sva.ast_id_increment:witness1" was covered in 2 cycles in 0.04 s by the incidental trace "data_manager.u_data_manager_sva.asm_retire_ptr_jump:witness1".
INFO (IPF047): 0.0.N: The cover property "data_manager.u_data_manager_sva.ast_id_increment:precondition1" was covered in 1 cycles in 0.04 s by the incidental trace "data_manager.u_data_manager_sva.asm_retire_ptr_jump:witness1".
INFO (IPF047): 0.0.N: The cover property "data_manager.u_data_manager_sva.ast_no_replay_outstanding:witness1" was covered in 1 cycles in 0.04 s by the incidental trace "data_manager.u_data_manager_sva.asm_retire_ptr_jump:witness1".
INFO (IPF047): 0.0.N: The cover property "data_manager.u_data_manager_sva.ast_no_replay_outstanding:precondition1" was covered in 1 cycles in 0.04 s by the incidental trace "data_manager.u_data_manager_sva.asm_retire_ptr_jump:witness1".
INFO (IPF047): 0.0.N: The cover property "data_manager.u_data_manager_sva.asm_retire_ptr_jump:precondition1" was covered in 2 cycles in 0.04 s.
INFO (IPF047): 0.0.N: The cover property "data_manager.u_data_manager_sva.asm_retire_ptr_range:precondition1" was covered in 2 cycles in 0.04 s.
0.0.N: Stopped processing property "data_manager.u_data_manager_sva.asm_retire_ptr_jump:witness1"	[0.04 s].
0.0.N: Stopped processing property "data_manager.u_data_manager_sva.asm_retire_ptr_jump:precondition1"	[0.04 s].
0.0.N: Stopped processing property "data_manager.u_data_manager_sva.asm_retire_ptr_range:precondition1"	[0.04 s].
0.0.N: Starting proof for property "data_manager.u_data_manager_sva.asm_abort_id_when_empty:witness1"	[0.00 s].
0.0.N: Trace Attempt  1	[0.00 s]
0.0.N: A trace with 1 cycles was found. [0.01 s]
INFO (IPF047): 0.0.N: The cover property "data_manager.u_data_manager_sva.asm_abort_id_when_empty:witness1" was covered in 1 cycles in 0.00 s.
INFO (IPF047): 0.0.N: The cover property "data_manager.u_data_manager_sva.asm_abort_id_when_empty:precondition1" was covered in 1 cycles in 0.00 s by the incidental trace "data_manager.u_data_manager_sva.asm_abort_id_when_empty:witness1".
INFO (IPF047): 0.0.N: The cover property "data_manager.u_data_manager_sva.asm_abort_id_valid_range:witness1" was covered in 1 cycles in 0.00 s by the incidental trace "data_manager.u_data_manager_sva.asm_abort_id_when_empty:witness1".
INFO (IPF047): 0.0.N: The cover property "data_manager.u_data_manager_sva.ast_abort_on_outstanding:witness1" was covered in 1 cycles in 0.00 s by the incidental trace "data_manager.u_data_manager_sva.asm_abort_id_when_empty:witness1".
INFO (IPF047): 0.0.N: The cover property "data_manager.u_data_manager_sva.asm_abort_id_valid_range:precondition1" was covered in 1 cycles in 0.00 s by the incidental trace "data_manager.u_data_manager_sva.asm_abort_id_when_empty:witness1".
INFO (IPF047): 0.0.N: The cover property "data_manager.u_data_manager_sva.ast_abort_on_outstanding:precondition1" was covered in 1 cycles in 0.00 s by the incidental trace "data_manager.u_data_manager_sva.asm_abort_id_when_empty:witness1".
INFO (IPF047): 0.0.N: The cover property "data_manager.u_data_manager_sva.ast_abort_update_data_id:precondition1" was covered in 1 cycles in 0.00 s by the incidental trace "data_manager.u_data_manager_sva.asm_abort_id_when_empty:witness1".
0.0.N: Stopped processing property "data_manager.u_data_manager_sva.asm_abort_id_when_empty:witness1"	[0.01 s].
0.0.N: Starting proof for property "data_manager.u_data_manager_sva.asm_abort_data_matches_sent:witness1"	[0.00 s].
0.0.N: Trace Attempt  1	[0.00 s]
0.0.Hp: Trace Attempt  1	[0.04 s]
0.0.Hp: A trace with 1 cycles was found. [0.04 s]
INFO (IPF047): 0.0.Hp: The cover property "data_manager.u_data_manager_sva.ast_stable_when_not_ready:precondition1" was covered in 1 cycles in 0.05 s.
0.0.N: Trace Attempt  2	[0.01 s]
0.0.B: Proofgrid shell started at 25446@localhost.localdomain(local) jg_7120_localhost.localdomain_3
0.0.N: Trace Attempt  2	[0.02 s]
0.0.B: clocks: 1, declared: 1, disabling: 0, posedge: 1, negedge: 0, noedge: 0, bothedge: 0
0.0.N: A trace with 2 cycles was found. [0.03 s]
INFO (IPF047): 0.0.N: The cover property "data_manager.u_data_manager_sva.asm_abort_data_matches_sent:witness1" was covered in 2 cycles in 0.01 s.
INFO (IPF047): 0.0.N: The cover property "data_manager.u_data_manager_sva.asm_abort_data_matches_sent:precondition1" was covered in 2 cycles in 0.01 s by the incidental trace "data_manager.u_data_manager_sva.asm_abort_data_matches_sent:witness1".
0.0.Ht: Proofgrid shell started at 25445@localhost.localdomain(local) jg_7120_localhost.localdomain_3
0.0.B: Next scan (0) will use per property time limit: 1s * 10 ^ 0 = 1s
0.0.B: Starting proof for property "data_manager.u_data_manager_sva.asm_abort_data_matches_sent:witness1"	[0.00 s].
0.0.N: Stopped processing property "data_manager.u_data_manager_sva.asm_abort_data_matches_sent:witness1"	[0.01 s].
0.0.N: Starting proof for property "data_manager.u_data_manager_sva.ast_stable_when_not_ready"	[0.00 s].
0.0.Ht: clocks: 1, declared: 1, disabling: 0, posedge: 1, negedge: 0, noedge: 0, bothedge: 0
0.0.N: Trace Attempt  1	[0.00 s]
0.0.N: Trace Attempt  2	[0.01 s]
0.0.B: Trace Attempt  1	[0.01 s]
0.0.N: Trace Attempt  2	[0.01 s]
0.0.N: Trace Attempt  3	[0.02 s]
0.0.Ht: Trace Attempt  1	[0.02 s]
0.0.B: Stopped processing property "data_manager.u_data_manager_sva.asm_abort_data_matches_sent:witness1"	[0.02 s].
0.0.B: Starting proof for property "data_manager.u_data_manager_sva.ast_stable_when_not_ready"	[0.00 s].
0.0.Ht: Trace Attempt  2	[0.03 s]
0.0.N: Trace Attempt  3	[0.04 s]
0.0.Ht: A trace with 2 cycles was found. [0.04 s]
INFO (IPF047): 0.0.Ht: The cover property "data_manager.u_data_manager_sva.ast_stable_when_not_ready:witness1" was covered in 2 cycles in 0.03 s.
0.0.B: Trace Attempt  1	[0.01 s]
0.0.Ht: A trace with 2 cycles was found. [0.04 s]
INFO (IPF055): 0.0.Ht: A counterexample (cex) with 2 cycles was found for the property "data_manager.u_data_manager_sva.ast_abort_update_data_id" in 0.04 s.
0.0.Ht: A trace with 2 cycles was found. [0.04 s]
INFO (IPF047): 0.0.Ht: The cover property "data_manager.u_data_manager_sva.ast_abort_update_data_id:witness1" was covered in 2 cycles in 0.04 s.
0.0.N: A trace with 3 cycles was found. [0.04 s]
INFO (IPF055): 0.0.N: A counterexample (cex) with 3 cycles was found for the property "data_manager.u_data_manager_sva.ast_stable_when_not_ready" in 0.05 s.
INFO (IPF055): 0.0.N: A counterexample (cex) with 3 cycles was found for the property "data_manager.u_data_manager_sva.ast_abort_on_outstanding" in 0.05 s by the incidental trace "data_manager.u_data_manager_sva.ast_stable_when_not_ready".
0.0.N: Stopped processing property "data_manager.u_data_manager_sva.ast_stable_when_not_ready"	[0.05 s].
0.0.N: Starting proof for property "data_manager.u_data_manager_sva.ast_id_increment"	[0.00 s].
0.0.N: Trace Attempt  1	[0.00 s]
0.0.B: Stopped processing property "data_manager.u_data_manager_sva.ast_stable_when_not_ready"	[0.03 s].
0.0.B: Starting proof for property "data_manager.u_data_manager_sva.ast_id_increment"	[0.00 s].
0.0.Ht: Trace Attempt  3	[0.05 s]
0.0.N: Trace Attempt  2	[0.01 s]
0.0.N: Trace Attempt  2	[0.01 s]
0.0.B: Trace Attempt  1	[0.01 s]
0.0.N: Trace Attempt  3	[0.02 s]
0.0.N: Trace Attempt  3	[0.03 s]
0.0.Ht: A trace with 3 cycles was found. [0.08 s]
INFO (IPF047): 0.0.Ht: The cover property "data_manager.u_data_manager_sva.ast_full_depth_outstanding:precondition1" was covered in 3 cycles in 0.08 s.
0.0.B: Trace Attempt  2	[0.03 s]
0.0.Ht: Trace Attempt  4	[0.09 s]
0.0.B: Trace Attempt  3	[0.05 s]
0.0.N: Trace Attempt  4	[0.05 s]
0.0.Ht: A trace with 4 cycles was found. [0.10 s]
INFO (IPF055): 0.0.Ht: A counterexample (cex) with 4 cycles was found for the property "data_manager.u_data_manager_sva.ast_full_depth_outstanding" in 0.10 s.
0.0.Ht: A trace with 4 cycles was found. [0.10 s]
INFO (IPF047): 0.0.Ht: The cover property "data_manager.u_data_manager_sva.ast_full_depth_outstanding:witness1" was covered in 4 cycles in 0.10 s.
0.0.Ht: A trace with 4 cycles was found. [0.11 s]
INFO (IPF055): 0.0.Ht: A counterexample (cex) with 4 cycles was found for the property "data_manager.u_data_manager_sva.ast_no_replay_outstanding" in 0.11 s.
0.0.Ht: Trace Attempt  5	[0.13 s]
0.0.B: Trace Attempt  4	[0.08 s]
0.0.N: Trace Attempt  4	[0.08 s]
0.0.Ht: A trace with 5 cycles was found. [0.14 s]
INFO (IPF055): 0.0.Ht: A counterexample (cex) with 5 cycles was found for the property "data_manager.u_data_manager_sva.ast_id_increment" in 0.14 s.
0.0.B: Stopped processing property "data_manager.u_data_manager_sva.ast_id_increment"	[0.09 s].
0.0.B: Last scan. Per property time limit: 0s
0.0.B: Starting proof for property "data_manager.u_data_manager_sva.cover_data_ids_wrap"	[0.00 s].
0.0.N: Stopped processing property "data_manager.u_data_manager_sva.ast_id_increment"	[0.09 s].
0.0.N: Last scan. Per property time limit: 0s
0.0.N: Starting proof for property "data_manager.u_data_manager_sva.cover_data_ids_wrap"	[0.00 s].
0.0.N: Trace Attempt  1	[0.00 s]
0.0.B: Trace Attempt  1	[0.01 s]
0.0.N: Trace Attempt  2	[0.01 s]
0.0.N: Trace Attempt  3	[0.01 s]
0.0.B: Trace Attempt  2	[0.02 s]
0.0.N: Trace Attempt  3	[0.03 s]
0.0.N: Trace Attempt  4	[0.04 s]
0.0.N: Trace Attempt  5	[0.04 s]
0.0.B: Trace Attempt  3	[0.04 s]
0.0.N: Trace Attempt  5	[0.07 s]
0.0.B: Trace Attempt  4	[0.07 s]
0.0.B: Trace Attempt  5	[0.10 s]
0.0.N: Requesting engine job to stop
0.0.B: Requesting engine job to stop
0.0.Hp: Requesting engine job to terminate
0.0.Ht: Requesting engine job to terminate
INFO (IPF144): 0: Initiating shutdown of proof [0.86]
0.0.Ht: Trace Attempt 49	[0.68 s]
0.0.Ht: A trace with 49 cycles was found. [0.79 s]
INFO (IPF047): 0.0.Ht: The cover property "data_manager.u_data_manager_sva.cover_data_ids_wrap" was covered in 49 cycles in 0.80 s.
0.0.Ht: All properties determined. [0.80 s]
0.0.Hp: Interrupted (multi)
0.0.Hp: Interrupted. [0.87 s]
0.0.Ht: Exited with Success (@ 0.88 s)
0: ProofGrid usable level: 0
0.0.Hp: Exited with Success (@ 0.88 s)
0.0.B: Stopped processing property "data_manager.u_data_manager_sva.cover_data_ids_wrap"	[0.69 s].
0.0.B: Trace Attempt 25	[0.64 s]
0.0.B: Interrupted. [0.84 s]
0.0.B: Exited with Success (@ 0.90 s)
0.0.N: Stopped processing property "data_manager.u_data_manager_sva.cover_data_ids_wrap"	[0.70 s].
0.0.N: Trace Attempt 18	[0.70 s]
0.0.N: Interrupted. [0.91 s]
0.0.N: Exited with Success (@ 0.92 s)
0: --------------------------------------------------------------
ProofGrid Summary
--------------------------------------------------------------
     engines started                               :     4
     engine jobs started                           :     4

    Average time in state (seconds)
    ------------------------------------------------------
    Engine  Pending     Running        Dead    Utilization
    ------------------------------------------------------
      N        0.06        0.86        0.00       93.42 %
     Hp        0.06        0.86        0.00       93.76 %
     Ht        0.06        0.80        0.00       93.02 %
      B        0.05        0.81        0.00       93.92 %
    all        0.06        0.83        0.00       93.53 %

    Data read    : 319.06 kiB
    Data written : 5.77 kiB

0: All pending notifications were processed.
INFO (IPF059): Completed proof on task: "<embedded>" for proof thread 0

==============================================================
SUMMARY
==============================================================
           Properties Considered              : 29
                 assertions                   : 6
                  - proven                    : 0 (0%)
                  - bounded_proven (user)     : 0 (0%)
                  - bounded_proven (auto)     : 0 (0%)
                  - marked_proven             : 0 (0%)
                  - cex                       : 6 (100%)
                  - ar_cex                    : 0 (0%)
                  - undetermined              : 0 (0%)
                  - unknown                   : 0 (0%)
                  - error                     : 0 (0%)
                 covers                       : 23
                  - unreachable               : 0 (0%)
                  - bounded_unreachable (user): 0 (0%)
                  - covered                   : 23 (100%)
                  - ar_covered                : 0 (0%)
                  - undetermined              : 0 (0%)
                  - unknown                   : 0 (0%)
                  - error                     : 0 (0%)
[<embedded>] % visualize -violation -property <embedded>::data_manager.u_data_manager_sva.ast_stable_when_not_ready -new_window
INFO (IVS015): Setting Visualize task to "<embedded>".
INFO (IVS008): Expanding analysis region to enable visualization of "<embedded>::data_manager.u_data_manager_sva.ast_stable_when_not_ready".
cex
[<embedded>] % visualize -violation -property <embedded>::data_manager.u_data_manager_sva.ast_stable_when_not_ready -new_window
INFO (IVS015): Setting Visualize task to "<embedded>".
INFO (IVS008): Expanding analysis region to enable visualization of "<embedded>::data_manager.u_data_manager_sva.ast_stable_when_not_ready".
cex
[<embedded>] % visualize -property <embedded>::data_manager.u_data_manager_sva.asm_abort_data_matches_sent:witness1 -new_window
INFO (IVS015): Setting Visualize task to "<embedded>".
INFO (IVS008): Expanding analysis region to enable visualization of "<embedded>::data_manager.u_data_manager_sva.asm_abort_data_matches_sent:witness1".
covered
[<embedded>] % visualize -property <embedded>::data_manager.u_data_manager_sva.ast_stable_when_not_ready:witness1 -new_window
INFO (IVS015): Setting Visualize task to "<embedded>".
INFO (IVS008): Expanding analysis region to enable visualization of "<embedded>::data_manager.u_data_manager_sva.ast_stable_when_not_ready:witness1".
covered
WARNING (WG013): Signal SIGTERM has been received in the analysis session.
WARNING (WG010): Signal SIGTERM has been caught. The analysis session will exit.
WARNING (WG013): Signal SIGHUP has been received in the analysis session.
WARNING (WG013): Signal SIGHUP has been received in the analysis session.
INFO: Waiting for proof threads to stop...
INFO: Proof threads stopped.
